Sheet: Panel
A1: panell_id | B1: CollectorID | C1: Start | D1: End | E1: Time | F1: Status | G1: 画面解像度 | H1: ブラウザ | I1: ブラウザバージョン | J1: プラットフォーム | K1: モバイルかどうか | L1: IPアドレス | M1: 属性 | N1: カスタムキー
A2: 358 | B2: 265 | C2: 2012-05-14T12:47:31.000 | D2: 2012-05-14T12:48:27.000 | E2: End-Start | F2: Complete | G2: 1024x768 | H2: Chrome | I2: 27.0.1453.110 | J2: Windows | K2: 0 | L2: 221.112.142.226 | M2: d955c3a841dac09ce1255f564ff078f74bebae9f
A3: 359 | B3: 265 | C3: 2012-05-14T21:52:41.000 | D3: 2012-05-14T21:53:51.000 | E3: End-Start | F3: Complete | G3: 320x568 | H3: Safari | I3: 6.1.4 | J3: iPhone | K3: 1 | L3: 221.112.142.226 | M3: 24def149a6f01c1b8904951ddf6b6fca8817b7c5
A4: 360 | B4: 265 | C4: 2012-05-14T23:54:23.000 | D4: 2012-05-14T23:55:09.000 | E4: End-Start | F4: ScreenOut | H4: Chrome | I4: 27.0.1453.110 | J4: Macintosh | K4: 0 | L4: 221.112.142.226 | M4: 1137090f4c2962a2db51196ae1a48e92ff6ba9ee
A5: 361 | B5: 265 | C5: 2012-05-14T23:56:56.000 | D5: 2012-05-14T23:59:12.000 | E5: End-Start | F5: Invalid | H5: Firefox | I5: 21.0 | J5: Macintosh | K5: 0 | L5: 221.112.142.226 | M5: 6e782fe2be4c19a7781595ed14e9314f121fec9b
A6: 362 | B6: 265 | C6: 2012-05-15T03:13:00.000 | D6: 2012-05-15T03:14:19.000 | E6: End-Start | F6: Invalid | G6: 320x568 | H6: Safari | I6: 6.1.4 | J6: iPhone | K6: 1 | L6: 221.112.142.226 | M6: 38bb37121529961c345b0eba52c0a52e6c0750d7
A7: 363 | B7: 265 | C7: 2012-05-14T12:47:31.000 | D7: 2012-05-14T12:48:27.000 | E7: End-Start | F7: Complete | G7: 1024x768 | H7: Chrome | I7: 27.0.1453.110 | J7: Windows | K7: 0 | L7: 221.112.142.226 | M7: d955c3a841dac09ce1255f564ff078f74bebae9f
A8: 364 | B8: 265 | C8: 2012-05-14T21:52:41.000 | D8: 2012-05-14T21:53:51.000 | E8: End-Start | F8: Complete | G8: 320x568 | H8: Safari | I8: 6.1.4 | J8: iPhone | K8: 1 | L8: 221.112.142.226 | M8: 24def149a6f01c1b8904951ddf6b6fca8817b7c5
A9: 365 | B9: 265 | C9: 2012-05-14T23:54:23.000 | D9: 2012-05-14T23:55:09.000 | E9: End-Start | F9: ScreenOut | H9: Chrome | I9: 27.0.1453.110 | J9: Macintosh | K9: 0 | L9: 221.112.142.226 | M9: 1137090f4c2962a2db51196ae1a48e92ff6ba9ee
A10: 366 | B10: 265 | C10: 2012-05-14T23:56:56.000 | D10: 2012-05-14T23:59:12.000 | E10: End-Start | F10: Invalid | H10: Firefox | I10: 21.0 | J10: Macintosh | K10: 0 | L10: 221.112.142.226 | M10: 6e782fe2be4c19a7781595ed14e9314f121fec9b
A11: 367 | B11: 265 | C11: 2012-05-15T03:13:00.000 | D11: 2012-05-15T03:14:19.000 | E11: End-Start | F11: Invalid | G11: 320x568 | H11: Safari | I11: 6.1.4 | J11: iPhone | K11: 1 | L11: 221.112.142.226 | M11: 38bb37121529961c345b0eba52c0a52e6c0750d7
A12: 368 | B12: 265 | C12: 2012-05-14T12:47:31.000 | D12: 2012-05-14T12:48:27.000 | E12: End-Start | F12: Complete | G12: 1024x768 | H12: Chrome | I12: 27.0.1453.110 | J12: Windows | K12: 0 | L12: 221.112.142.226 | M12: d955c3a841dac09ce1255f564ff078f74bebae9f
A13: 369 | B13: 265 | C13: 2012-05-14T21:52:41.000 | D13: 2012-05-14T21:53:51.000 | E13: End-Start | F13: Complete | G13: 320x568 | H13: Safari | I13: 6.1.4 | J13: iPhone | K13: 1 | L13: 221.112.142.226 | M13: 24def149a6f01c1b8904951ddf6b6fca8817b7c5
A14: 370 | B14: 265 | C14: 2012-05-14T23:54:23.000 | D14: 2012-05-14T23:55:09.000 | E14: End-Start | F14: ScreenOut | H14: Chrome | I14: 27.0.1453.110 | J14: Macintosh | K14: 0 | L14: 221.112.142.226 | M14: 1137090f4c2962a2db51196ae1a48e92ff6ba9ee
A15: 371 | B15: 265 | C15: 2012-05-14T23:56:56.000 | D15: 2012-05-14T23:59:12.000 | E15: End-Start | F15: Invalid | H15: Firefox | I15: 21.0 | J15: Macintosh | K15: 0 | L15: 221.112.142.226 | M15: 6e782fe2be4c19a7781595ed14e9314f121fec9b
A16: 372 | B16: 265 | C16: 2012-05-15T03:13:00.000 | D16: 2012-05-15T03:14:19.000 | E16: End-Start | F16: Invalid | G16: 320x568 | H16: Safari | I16: 6.1.4 | J16: iPhone | K16: 1 | L16: 221.112.142.226 | M16: 38bb37121529961c345b0eba52c0a52e6c0750d7
A17: 373 | B17: 265 | C17: 2012-05-14T12:47:31.000 | D17: 2012-05-14T12:48:27.000 | E17: End-Start | F17: Complete | G17: 1024x768 | H17: Chrome | I17: 27.0.1453.110 | J17: Windows | K17: 0 | L17: 221.112.142.226 | M17: d955c3a841dac09ce1255f564ff078f74bebae9f
A18: 374 | B18: 265 | C18: 2012-05-14T21:52:41.000 | D18: 2012-05-14T21:53:51.000 | E18: End-Start | F18: Complete | G18: 320x568 | H18: Safari | I18: 6.1.4 | J18: iPhone | K18: 1 | L18: 221.112.142.226 | M18: 24def149a6f01c1b8904951ddf6b6fca8817b7c5
A19: 375 | B19: 265 | C19: 2012-05-14T23:54:23.000 | D19: 2012-05-14T23:55:09.000 | E19: End-Start | F19: ScreenOut | H19: Chrome | I19: 27.0.1453.110 | J19: Macintosh | K19: 0 | L19: 221.112.142.226 | M19: 1137090f4c2962a2db51196ae1a48e92ff6ba9ee
A20: 376 | B20: 265 | C20: 2012-05-14T23:56:56.000 | D20: 2012-05-14T23:59:12.000 | E20: End-Start | F20: Invalid | H20: Firefox | I20: 21.0 | J20: Macintosh | K20: 0 | L20: 221.112.142.226 | M20: 6e782fe2be4c19a7781595ed14e9314f121fec9b
A21: 377 | B21: 265 | C21: 2012-05-15T03:13:00.000 | D21: 2012-05-15T03:14:19.000 | E21: End-Start | F21: Invalid | G21: 320x568 | H21: Safari | I21: 6.1.4 | J21: iPhone | K21: 1 | L21: 221.112.142.226 | M21: 38bb37121529961c345b0eba52c0a52e6c0750d7

Sheet: Answer data
B1: 1.アンケートに協力よろしくお願いします。CREATIVE SURVEYの質問タイプサンプルです。 | C1: 2.好きな食べ物を選択してください。SELECT TEXT｜テキストで回答するタイプ | G1: 3.好きな画像を選択してください。SELECT CREATIVE｜画像で回答するタイプです。 | J1: 4.すきな言葉を最大2つ挙げてください。※回答したくない方は空欄のままで大丈夫です。※FREE TEXT｜自由記述タイプです。 | L1: 5.当てはまるものを選択してください。MATRIX｜マトリックスで回答するタイプです。 | U1: 6.ご自身の正確に近いと感じる方へスライドバーを動かしてお答えください。SLIDER｜スライドバータイプです。 | W1: 7.あなたの思う箇所にスライドを動かしてお答えください。MULTI SLIDER｜スライドバーを動かして比較しながら回答するタイプです。 | Z1: 8.次の画像で初めに目の言った箇所をクリックしてください。CRITZ POINT｜クリックして回答終了のタイプです。 | AB1: 9.表示される画像にコメントしてください。AREA MAPPING｜ドラッグで選択してコメントを書き込むタイプです。
A2: ID | B2: 1_1 | C2: 2_1_1 | D2: 2_1_2 | E2: 2_1_3 | F2: 2_1_4 | G2: 3_1_1 | H2: 3_1_2 | I2: 3_1_3 | J2: 4_1 | K2: 4_2 | L2: 5_1_1 | M2: 5_1_2 | N2: 5_1_3 | O2: 5_2_1 | P2: 5_2_2 | Q2: 5_2_3 | R2: 5_3_1 | S2: 5_3_2 | T2: 5_3_3 | U2: 6_1 | V2: 6_2 | W2: 7_1_1 | X2: 7_1_2 | Y2: 7_1_3 | Z2: 8_1 | AA2: 8_2 | AB2: 9_1_1 | AC2: 9_2 | AD2: 9_3 | AE2: 9_4 | AF2: 9_5 | AG2: 9_6
A3: 項目 | B3: - | C3: りんご | D3: ばなな | E3: ぶどう | F3: みかん | G3: 491ffc8f6f7d1fb1061a30a039a7fdb8a06eea691338282052.gif | H3: grapes.jpg | I3: nousanbutu2210-thumb.jpg | J3: 好きな言葉１ | K3: 好きな言葉２ | L3: りんご | O3: バナナ | R3: ぶどう | U3: 柔軟な ⇒ 頑固な | V3: 陰気な ⇒ 陽気な | W3: 安価な ⇒ 高価な | X3: 安価な ⇒ 高価な | Y3: 安価な ⇒ 高価な | Z3: X | AA3: Y | AB3: impression | AC3: コメント | AD3: x | AE3: y | AF3: width | AG3: height
A4: サブ項目 | L4: 朝 | M4: 昼 | N4: 夜 | O4: 朝 | P4: 昼 | Q4: 夜 | R4: 朝 | S4: 昼 | T4: 夜 | W4: nousanbutu2210-thumb.jpg | X4: img_1161129_52606262_2.png | Y4: grapes.jpg
A5: 358 | B5: - | C5: 1 | D5: 0 | E5: 1 | F5: 1 | G5: 1 | H5: 0 | I5: 0 | J5: ダミーダミーダミー | L5: 1 | M5: 0 | N5: 0 | O5: 1 | P5: 0 | Q5: 0 | R5: 0 | S5: 1 | T5: 0 | U5: 2 | V5: 1 | W5: 2 | X5: 1 | Y5: 1 | Z5: 0.44414300000000001 | AA5: 0.63232100000000002 | AB5: 1 | AC5: ダミーダミーダミー | AD5: 0.17671300000000001 | AE5: 0.49825799999999998 | AF5: 8.8356699999999996E-2 | AG5: 7.83972E-2
A6: 359 | B6: - | C6: 0 | D6: 1 | E6: 0 | F6: 1 | G6: 0 | H6: 1 | I6: 0 | J6: ダミーダミーダミー | K6: ダミーダミーダミー | L6: 0 | M6: 1 | N6: 0 | O6: 0 | P6: 1 | Q6: 0 | R6: 0 | S6: 1 | T6: 0 | U6: 0.22500000000000001 | V6: 0.55681818181818199 | W6: 0.22500000000000001 | X6: 0.55681818181818199 | Y6: 0.55681818181818199 | Z6: 0.51138799999999995 | AA6: 0.55965299999999996 | AB6: -1 | AC6: ダミーダミーダミー | AD6: 0.26506999999999997 | AE6: 0.56271800000000005 | AF6: 8.9182499999999998E-2 | AG6: 6.7944299999999999E-2
A7: 360 | B7: - | C7: 0 | D7: 0 | E7: 1 | F7: 0 | G7: 0 | H7: 0 | I7: 1 | J7: ダミーダミーダミー | L7: 1 | M7: 0 | N7: 0 | O7: 1 | P7: 0 | Q7: 0 | R7: 1 | S7: 0 | T7: 0 | U7: 0.70833333333333304 | V7: 0.26439393939393901 | W7: 0.70833333333333304 | X7: 0.26439393939393901 | Y7: 0.26439393939393901 | Z7: 0.55911100000000002 | AA7: 0.214751 | AB7: 0 | AC7: ダミーダミーダミー | AD7: 0.78612700000000002 | AE7: 0.25348399999999999 | AF7: 0.12551599999999999 | AG7: 0.17508699999999999
A8: 361 | B8: - | C8: 0 | D8: 1 | E8: 1 | F8: 0 | G8: 1 | H8: 0 | I8: 0 | J8: ダミーダミーダミー | K8: ダミーダミーダミー | L8: 1 | M8: 0 | N8: 0 | O8: 0 | P8: 1 | Q8: 0 | R8: 0 | S8: 1 | T8: 0 | U8: 0.64621212121212102 | V8: 0.56136363636363595 | W8: 0.64621212121212102 | X8: 0.56136363636363595 | Y8: 0.56136363636363595 | Z8: 0.43763600000000002 | AA8: 0.63449 | AB8: 1 | AC8: ダミーダミーダミー | AD8: 5.1197399999999997E-2 | AE8: 3.5714299999999997E-2 | AF8: 0.74979399999999996 | AG8: 0.41986099999999998
A9: 362 | B9: - | C9: 1 | D9: 0 | E9: 0 | F9: 1 | G9: 0 | H9: 0 | I9: 1 | J9: ダミーダミーダミー | K9: ダミーダミーダミー | L9: 0 | M9: 0 | N9: 1 | O9: 1 | P9: 0 | Q9: 0 | R9: 0 | S9: 0 | T9: 1 | U9: 0.23863636363636401 | V9: 0.5 | W9: 0.23863636363636401 | X9: 0.5 | Y9: 0.5 | Z9: 0.52115 | AA9: 0.240781 | AB9: -1 | AC9: ダミーダミーダミー | AD9: 0.10817499999999999 | AE9: 6.0975599999999998E-2 | AF9: 0.72832399999999997 | AG9: 0.268293
A10: 363 | B10: - | C10: 1 | D10: 0 | E10: 1 | F10: 1 | G10: 1 | H10: 0 | I10: 0 | J10: ダミーダミーダミー | L10: 1 | M10: 0 | N10: 0 | O10: 1 | P10: 0 | Q10: 0 | R10: 0 | S10: 1 | T10: 0 | U10: 2 | V10: 1 | W10: 2 | X10: 1 | Y10: 1 | Z10: 0.44414300000000001 | AA10: 0.63232100000000002 | AB10: 0 | AC10: ダミーダミーダミー | AD10: 0.17671300000000001 | AE10: 0.49825799999999998 | AF10: 8.8356699999999996E-2 | AG10: 7.83972E-2
A11: 364 | B11: - | C11: 0 | D11: 1 | E11: 0 | F11: 1 | G11: 0 | H11: 1 | I11: 0 | J11: ダミーダミーダミー | L11: 0 | M11: 1 | N11: 0 | O11: 0 | P11: 1 | Q11: 0 | R11: 0 | S11: 1 | T11: 0 | U11: 0.22500000000000001 | V11: 0.55681818181818199 | W11: 0.22500000000000001 | X11: 0.55681818181818199 | Y11: 0.55681818181818199 | Z11: 0.51138799999999995 | AA11: 0.55965299999999996 | AB11: 1 | AC11: ダミーダミーダミー | AD11: 0.26506999999999997 | AE11: 0.56271800000000005 | AF11: 8.9182499999999998E-2 | AG11: 6.7944299999999999E-2
A12: 365 | B12: - | C12: 0 | D12: 0 | E12: 1 | F12: 0 | G12: 0 | H12: 0 | I12: 1 | J12: ダミーダミーダミー | K12: ダミーダミーダミー | L12: 1 | M12: 0 | N12: 0 | O12: 1 | P12: 0 | Q12: 0 | R12: 1 | S12: 0 | T12: 0 | U12: 0.70833333333333304 | V12: 0.26439393939393901 | W12: 0.70833333333333304 | X12: 0.26439393939393901 | Y12: 0.26439393939393901 | Z12: 0.55911100000000002 | AA12: 0.214751 | AB12: -1 | AC12: ダミーダミーダミー | AD12: 0.78612700000000002 | AE12: 0.25348399999999999 | AF12: 0.12551599999999999 | AG12: 0.17508699999999999
A13: 366 | B13: - | C13: 0 | D13: 1 | E13: 1 | F13: 0 | G13: 1 | H13: 0 | I13: 0 | J13: ダミーダミーダミー | L13: 1 | M13: 0 | N13: 0 | O13: 0 | P13: 1 | Q13: 0 | R13: 0 | S13: 1 | T13: 0 | U13: 0.64621212121212102 | V13: 0.56136363636363595 | W13: 0.64621212121212102 | X13: 0.56136363636363595 | Y13: 0.56136363636363595 | Z13: 0.43763600000000002 | AA13: 0.63449 | AB13: 1 | AC13: ダミーダミーダミー | AD13: 5.1197399999999997E-2 | AE13: 3.5714299999999997E-2 | AF13: 0.74979399999999996 | AG13: 0.41986099999999998
A14: 367 | B14: - | C14: 1 | D14: 0 | E14: 0 | F14: 1 | G14: 0 | H14: 0 | I14: 1 | L14: 0 | M14: 0 | N14: 1 | O14: 1 | P14: 0 | Q14: 0 | R14: 0 | S14: 0 | T14: 1 | U14: 0.23863636363636401 | V14: 0.5 | W14: 0.23863636363636401 | X14: 0.5 | Y14: 0.5 | Z14: 0.52115 | AA14: 0.240781 | AB14: -1 | AC14: ダミーダミーダミー | AD14: 0.10817499999999999 | AE14: 6.0975599999999998E-2 | AF14: 0.72832399999999997 | AG14: 0.268293
A15: 368 | B15: - | C15: 1 | D15: 0 | E15: 1 | F15: 1 | G15: 1 | H15: 0 | I15: 0 | J15: ダミーダミーダミー | L15: 1 | M15: 0 | N15: 0 | O15: 1 | P15: 0 | Q15: 0 | R15: 0 | S15: 1 | T15: 0 | U15: 2 | V15: 1 | W15: 2 | X15: 1 | Y15: 1 | Z15: 0.44414300000000001 | AA15: 0.63232100000000002 | AB15: 0 | AC15: ダミーダミーダミー | AD15: 0.17671300000000001 | AE15: 0.49825799999999998 | AF15: 8.8356699999999996E-2 | AG15: 7.83972E-2
A16: 369 | B16: - | C16: 0 | D16: 1 | E16: 0 | F16: 1 | G16: 0 | H16: 1 | I16: 0 | L16: 0 | M16: 1 | N16: 0 | O16: 0 | P16: 1 | Q16: 0 | R16: 0 | S16: 1 | T16: 0 | U16: 0.22500000000000001 | V16: 0.55681818181818199 | W16: 0.22500000000000001 | X16: 0.55681818181818199 | Y16: 0.55681818181818199 | Z16: 0.51138799999999995 | AA16: 0.55965299999999996 | AB16: 1 | AC16: ダミーダミーダミー | AD16: 0.26506999999999997 | AE16: 0.56271800000000005 | AF16: 8.9182499999999998E-2 | AG16: 6.7944299999999999E-2
A17: 370 | B17: - | C17: 0 | D17: 0 | E17: 1 | F17: 0 | G17: 0 | H17: 0 | I17: 1 | L17: 1 | M17: 0 | N17: 0 | O17: 1 | P17: 0 | Q17: 0 | R17: 1 | S17: 0 | T17: 0 | U17: 0.70833333333333304 | V17: 0.26439393939393901 | W17: 0.70833333333333304 | X17: 0.26439393939393901 | Y17: 0.26439393939393901 | Z17: 0.55911100000000002 | AA17: 0.214751 | AB17: -1 | AC17: ダミーダミーダミー | AD17: 0.78612700000000002 | AE17: 0.25348399999999999 | AF17: 0.12551599999999999 | AG17: 0.17508699999999999
A18: 371 | B18: - | C18: 0 | D18: 1 | E18: 1 | F18: 0 | G18: 1 | H18: 0 | I18: 0 | J18: ダミーダミーダミー | K18: ダミーダミーダミー | L18: 1 | M18: 0 | N18: 0 | O18: 0 | P18: 1 | Q18: 0 | R18: 0 | S18: 1 | T18: 0 | U18: 0.64621212121212102 | V18: 0.56136363636363595 | W18: 0.64621212121212102 | X18: 0.56136363636363595 | Y18: 0.56136363636363595 | Z18: 0.43763600000000002 | AA18: 0.63449 | AB18: 0 | AC18: ダミーダミーダミー | AD18: 5.1197399999999997E-2 | AE18: 3.5714299999999997E-2 | AF18: 0.74979399999999996 | AG18: 0.41986099999999998
A19: 372 | B19: - | C19: 1 | D19: 0 | E19: 0 | F19: 1 | G19: 0 | H19: 0 | I19: 1 | L19: 0 | M19: 0 | N19: 1 | O19: 1 | P19: 0 | Q19: 0 | R19: 0 | S19: 0 | T19: 1 | U19: 0.23863636363636401 | V19: 0.5 | W19: 0.23863636363636401 | X19: 0.5 | Y19: 0.5 | Z19: 0.52115 | AA19: 0.240781 | AB19: 1 | AC19: ダミーダミーダミー | AD19: 0.10817499999999999 | AE19: 6.0975599999999998E-2 | AF19: 0.72832399999999997 | AG19: 0.268293
A20: 373 | B20: - | C20: 1 | D20: 0 | E20: 1 | F20: 1 | G20: 1 | H20: 0 | I20: 0 | J20: ダミーダミーダミー | L20: 1 | M20: 0 | N20: 0 | O20: 1 | P20: 0 | Q20: 0 | R20: 0 | S20: 1 | T20: 0 | U20: 2 | V20: 1 | W20: 2 | X20: 1 | Y20: 1 | Z20: 0.44414300000000001 | AA20: 0.63232100000000002 | AB20: -1 | AC20: ダミーダミーダミー | AD20: 0.17671300000000001 | AE20: 0.49825799999999998 | AF20: 8.8356699999999996E-2 | AG20: 7.83972E-2
A21: 374 | B21: - | C21: 0 | D21: 1 | E21: 0 | F21: 1 | G21: 0 | H21: 1 | I21: 0 | L21: 0 | M21: 1 | N21: 0 | O21: 0 | P21: 1 | Q21: 0 | R21: 0 | S21: 1 | T21: 0 | U21: 0.22500000000000001 | V21: 0.55681818181818199 | W21: 0.22500000000000001 | X21: 0.55681818181818199 | Y21: 0.55681818181818199 | Z21: 0.51138799999999995 | AA21: 0.55965299999999996 | AB21: 0 | AC21: ダミーダミーダミー | AD21: 0.26506999999999997 | AE21: 0.56271800000000005 | AF21: 8.9182499999999998E-2 | AG21: 6.7944299999999999E-2
A22: 375 | B22: - | C22: 0 | D22: 0 | E22: 1 | F22: 0 | G22: 0 | H22: 0 | I22: 1 | L22: 1 | M22: 0 | N22: 0 | O22: 1 | P22: 0 | Q22: 0 | R22: 1 | S22: 0 | T22: 0 | U22: 0.70833333333333304 | V22: 0.26439393939393901 | W22: 0.70833333333333304 | X22: 0.26439393939393901 | Y22: 0.26439393939393901 | Z22: 0.55911100000000002 | AA22: 0.214751 | AB22: 1 | AC22: ダミーダミーダミー | AD22: 0.78612700000000002 | AE22: 0.25348399999999999 | AF22: 0.12551599999999999 | AG22: 0.17508699999999999
A23: 376 | B23: - | C23: 0 | D23: 1 | E23: 1 | F23: 0 | G23: 1 | H23: 0 | I23: 0 | K23: ダミーダミーダミー | L23: 1 | M23: 0 | N23: 0 | O23: 0 | P23: 1 | Q23: 0 | R23: 0 | S23: 1 | T23: 0 | U23: 0.64621212121212102 | V23: 0.56136363636363595 | W23: 0.64621212121212102 | X23: 0.56136363636363595 | Y23: 0.56136363636363595 | Z23: 0.43763600000000002 | AA23: 0.63449 | AB23: -1 | AC23: ダミーダミーダミー | AD23: 5.1197399999999997E-2 | AE23: 3.5714299999999997E-2 | AF23: 0.74979399999999996 | AG23: 0.41986099999999998
A24: 377 | B24: - | C24: 1 | D24: 0 | E24: 0 | F24: 1 | G24: 0 | H24: 0 | I24: 1 | K24: ダミーダミーダミー | L24: 0 | M24: 0 | N24: 1 | O24: 1 | P24: 0 | Q24: 0 | R24: 0 | S24: 0 | T24: 1 | U24: 0.23863636363636401 | V24: 0.5 | W24: 0.23863636363636401 | X24: 0.5 | Y24: 0.5 | Z24: 0.52115 | AA24: 0.240781 | AB24: 0 | AC24: ダミーダミーダミー | AD24: 0.10817499999999999 | AE24: 6.0975599999999998E-2 | AF24: 0.72832399999999997 | AG24: 0.268293
Z26: test

Sheet: Q1.report
A1: 1.アンケートに協力よろしくお願いします。CREATIVE SURVEYの質問タイプサンプルです。
A3: ステップ | B3: 1
A4: 回答タイプ | B4: welcome
A5: 提示画像 | B5: -
A6: 回答人数 | B6: =SUBTOTAL(2,R[5]C[-1]:R[24]C[-1]) -> 0
A7: 平均回答時間 | B7: 1900-01-04T12:00:00.000

Sheet: Q2.Report
A1: 2.好きな食べ物を選択してください。SELECT TEXT｜テキストで回答するタイプ
A3: ステップ | B3: 2
A4: 回答タイプ | B4: SELECT-TEXT
A5: 提示画像 | B5: -
A6: 回答人数 | B6: =SUBTOTAL(2,R[6]C[-1]:R[25]C[-1]) -> 0
A7: 平均回答時間 | B7: =SUBTOTAL(1,R[5]C:R[24]C) -> 1900-01-04T12:00:00.000
A10: 項目 | B10: 選択数 | C10: 割合
A11: リンゴ | B11: 2 | C11: =RC[-1]/R15C2 -> 0.2
A12: バナナ | B12: 2 | C12: =RC[-1]/R15C2 -> 0.2
A13: みかん | B13: 3 | C13: =RC[-1]/R15C2 -> 0.3
A14: ぶどう | B14: 3 | C14: =RC[-1]/R15C2 -> 0.3
A15: 合計 | B15: 10 | C15: -

Sheet: Q3.report
A1: 3.好きな画像を選択してください。SELECT CREATIVE｜画像で回答するタイプです。
A3: ステップ | B3: 3
A4: 回答タイプ | B4: SELECT-CREATIVE
A5: 提示画像 | B5: -
A6: 回答人数 | B6: =SUBTOTAL(2,R[7]C[-1]:R[25]C[-1]) -> 0
A7: 平均回答時間 | B7: =SUBTOTAL(1,R[5]C:R[24]C) -> 1900-01-03T08:00:00.000
A10: 項目 | B10: 選択数 | C10: 割合
A11: nousanbutu2210-thumb.jpg | B11: 3 | C11: =RC[-1]/R14C2 -> 0.42857142857142855
A12: 491ffc8f6f7d1fb1061a30a039a7fdb8a06eea691338282052.gif | B12: 2 | C12: =RC[-1]/R14C2 -> 0.2857142857142857
A13: grapes.jpg | B13: 1 | C13: =RC[-1]/R14C2 -> 0.14285714285714285
A14: 合計 | B14: 7 | C14: -

Sheet: Q4.Report
A1: 4.すきな言葉を最大2つ挙げてください。※回答したくない方は空欄のままで大丈夫です。※FREE TEXT｜自由記述タイプです。
A3: ステップ | B3: 4
A4: 回答タイプ | B4: FREE_TEXT
A5: 提示画像 | B5: -
A6: 回答人数 | B6: =SUBTOTAL(2,R[5]C[-1]:R[24]C[-1]) -> 0
A7: 平均回答時間 | B7: =SUBTOTAL(1,R[5]C:R[24]C) -> 1900-01-06T12:00:00.000
A10: 項目 | B10: 回答数 | C10: 回答率
A11: 自由入力項目1 | B11: 5 | C11: =RC[-1]/R[2]C[-1] -> 0.55555555555555558
A12: 自由入力項目2 | B12: 4 | C12: =RC[-1]/R[1]C[-1] -> 0.44444444444444442
A13: 合計 | B13: 9 | C13: -

Sheet: Q5.report
A1: 5.当てはまるものを選択してください。MATRIX｜マトリックスで回答するタイプです。
A3: ステップ | B3: 5
A4: 回答タイプ | B4: Matrix
A5: 提示画像 | B5: -
A6: 回答人数 | B6: =SUBTOTAL(2,R[5]C[-1]:R[17]C[-1]) -> 0
A7: 平均回答時間 | B7: =SUBTOTAL(1,R[5]C:R[24]C) -> 1900-01-02T00:00:00.000
A10: 項目 | B10: 朝 | C10: 昼 | D10: 夜 | E10: 合計
A11: りんご | B11: 3 | C11: 1 | D11: 1 | E11: 5
A12: ばなな | B12: 3 | C12: 2 | D12: 0 | E12: 5
A13: ぶどう | B13: 1 | C13: 3 | D13: 1 | E13: 5
A14: 合計 | E14: 15

Sheet: Q6.report
A1: 6.ご自身の正確に近いと感じる方へスライドバーを動かしてお答えください。SLIDER｜スライドバータイプです。
A3: ステップ | B3: 6
A4: 回答タイプ | B4: Slider
A5: 提示画像 | B5: -
A6: 回答人数 | B6: =SUBTOTAL(2,R[4]C[-1]:R[17]C[-1]) -> 0
A7: 平均回答時間 | B7: =SUBTOTAL(1,R[5]C:R[24]C) -> 1899-12-31T14:57:32.727
A10: 対象画像 | B10: 平均値
A11: 柔軟な ⇒ 頑固な | B11: 0.76363636363636367
A12: 陰気な ⇒ 陽気な | B12: 0.57651515151515142
A13: 平均値 | B13: =AVERAGE(R[-2]C:R[-1]C) -> 0.67007575757575755

Sheet: Q7.report
A1: 7.あなたの思う箇所にスライドを動かしてお答えください。MULTI SLIDER｜スライドバーを動かして比較しながら回答するタイプです。
A3: ステップ | B3: 7
A4: 回答タイプ | B4: Multi Slider
A5: 提示画像 | B5: -
A6: 回答人数 | B6: =SUBTOTAL(2,R[4]C[-1]:R[21]C[-1]) -> 0
A7: 平均回答時間 | B7: =SUBTOTAL(1,R[3]C:R[20]C) -> 1899-12-31T18:19:38.182
A10: 対象画像 | B10: nousanbutu2210-thumb.jpg | C10: img_1161129_52606262_2.png | D10: grapes.jpg | E10: 平均値
A11: 安価な ⇒ 高価な | B11: 0.76363636363636367 | C11: 0.57651515151515142 | D11: 0.57651515151515142 | E11: =AVERAGE(RC[-3]:RC[-2]) -> 0.67007575757575755
A12: 平均値 | B12: =AVERAGE(R[-1]C:R[-1]C) -> 0.76363636363636367 | C12: =AVERAGE(R[-1]C:R[-1]C) -> 0.57651515151515142 | D12: =AVERAGE(R[-1]C:R[-1]C) -> 0.57651515151515142 | E12: =AVERAGE(R[-1]C:R[-1]C) -> 0.67007575757575755

Sheet: Q8.Report
A1: 8.次の画像で初めに目の言った箇所をクリックしてください。CRITZ POINT｜クリックして回答終了のタイプです。
A3: ステップ | B3: 8
A4: 回答タイプ | B4: Critz Point
A5: 提示画像 | B5: -
A6: 回答人数 | B6: =SUBTOTAL(2,R[5]C[-1]:R[24]C[-1]) -> 0
A7: 平均回答時間 | B7: =SUBTOTAL(1,R[3]C:R[23]C) -> 1899-12-31T11:52:20.836
A10: 対象画像 | B10: X | C10: Y
A11: img_1161129_52606262_2.png | B11: 0.49468559999999995 | C11: 0.45639920000000006

Sheet: Q9.Report
A1: 9.表示される画像にコメントしてください。AREA MAPPING｜ドラッグで選択してコメントを書き込むタイプです。
A3: ステップ | B3: 9
A4: 回答タイプ | B4: Area mapping
A5: 提示画像 | B5: -
A6: 回答人数 | B6: =SUBTOTAL(2,R[3]C[-1]:R[22]C[-1]) -> 3
A7: 平均回答時間 | B7: 1899-12-31T00:01:14.400
A10: impression | B10: コメント数 | C10: 割合
A11: 1 | B11: 3 | C11: =RC[-1]/R[3]C[-1] -> 0.375
A12: -1 | B12: 2 | C12: =RC[-1]/R[2]C[-1] -> 0.25
A13: 0 | B13: 3 | C13: =RC[-1]/R[1]C[-1] -> 0.375
A14: TOTAL | B14: 8 | C14: -